{
 "$schema": "schemas/models-v1.schema.json",
 "id": "decision-model-catalog-models",
 "schema_version": 1,
 "generated_at": "2026-10-07",
 "notes": [
  "L0 registry of DECISION models only (Decision Index 0.3 entrants with identifiable weights or hosts are included, most as community_finetune or third_party_board_only). Join key for pricing, performance, capabilities and caveats.",
  "General LLM baselines are NOT listed here: model strings resolve against this file first, then data/model-catalog/models.json (ids + aliases). Rows for baselines used by sources (Opus 5.5, GPT-5.5, GPT-5.6 Luna, Haiku 4.5, DeepSeek V4.1 Flash, Gemini 3.5 Flash-Lite, Qwen3.8-27B, GPT-6 Astra, ...) reference the model-catalog id. Baselines that model-catalog lacks (gpt-5-nano, qwen3.6-27b, qwen3.5-4b, terra/luna/sol versions on TypeSafe Evals) are recorded in the missing[] of the document that uses them.",
  "Harness-suffixed score ids (model@harness) resolve to the base id. Aliases include API ids, OpenRouter ids, @cf ids and Hugging Face repos; provider-qualified router ids (sference/clef, cloudflare/clef) are aliases so a row can keep its serving provider.",
  "params_total is the Hugging Face safetensors total when a repo count was read (Clef, Clef-flash, Perplexity) and otherwise the Decision Index served_params, which uses the base-model figure; each model note says which. null means unknown.",
  "status third_party_board_only = known only from a board or listing (no first-party docs or no identifiable weights). community_finetune = open weights from an independent author. Licenses are the Hugging Face cardData field, not verified against LICENSE files."
 ],
 "models": [
  {
   "id": "jev-1.13.0",
   "provider": "typesafe",
   "family": "Jev (System One)",
   "status": "early_access",
   "aliases": [
    "jev-latest",
    "jev-preview",
    "typesafe/jev-1.13",
    "~typesafe/jev-latest",
    "typesafe/jev-latest",
    "typesafe-ai/jev",
    "Jev",
    "jev"
   ],
   "weights": "closed",
   "license": null,
   "base_model": null,
   "params_total": null,
   "params_active": null,
   "hf_repo": null,
   "surfaces": [
    "typesafe-api",
    "openrouter",
    "other"
   ],
   "released": "2026-09-15",
   "release_source_id": "typesafe-launch-blog",
   "access": "general",
   "caveat_ids": [
    "model-version-and-api-drift",
    "price-third-party-aggregator-sites",
    "abstention-and-out-of-scope",
    "determinism-and-option-order",
    "context-window-and-rot",
    "diogo-reliability-claim-untested"
   ],
   "notes": "TypeSafe hosted System One model (RLCD-trained). Weights closed; same weights serve every account (no fine-tuning). Aliases jev-latest and jev-preview both pointed to jev-1.13.0 on 2026-10-07 (docs: \"There is no preview build available right now.\"). Released 2026-09-15 as early access (launch blog); OpenRouter lists typesafe/jev-1.13 as created 2026-09-17/18. jev-1.12 appears only in the parallel-questions cookbook. Base model and parameter count are not disclosed. Also on Requesty (typesafe/jev-latest); Vercel AI Gateway listing reported by a third party only. Official price page: docs.typesafe.ai/models (not jevaihub.com)."
  },
  {
   "id": "clef",
   "provider": "cloudflare",
   "family": "Clef",
   "status": "ga",
   "aliases": [
    "@cf/cloudflare/clef",
    "Cloudflare/clef",
    "cloudflare/clef",
    "sference/clef",
    "Cloudflare clef",
    "Clef"
   ],
   "weights": "open",
   "license": "Apache-2.0",
   "base_model": "Qwen/Qwen3.8-27B",
   "params_total": 27356728560,
   "params_active": null,
   "hf_repo": "Cloudflare/clef",
   "surfaces": [
    "workers-ai",
    "openrouter",
    "self-host",
    "hf-inference",
    "other"
   ],
   "tier": "clef",
   "released": "2026-10-01",
   "release_source_id": "cloudflare-changelog-clef",
   "access": "general",
   "caveat_ids": [
    "latency-hosted-rtt-vs-on-card",
    "vendor-run-eval-of-competitor",
    "workers-ai-state-truncation-2k",
    "same-weights-different-serving-limits-and-confidence",
    "confidence-field-non-portable",
    "leaderboard-edition-and-weighting-flip-rankings"
   ],
   "notes": "Cloudflare Workers AI decision model: frozen Qwen3.8-27B backbone + vision encoder + joint schema head with rank-256 LoRA (blog); prefill-only. params_total is the HF safetensors total (27,356,728,560); the Cloudflare label is 27B and the Decision Index lists served_params 27.8B (base-model figure). HF repos created 2026-09-30; launch 2026-10-01. Open weights, Apache-2.0; training data and pipeline not published. Hosted on Workers AI (@cf/cloudflare/clef; body model field must be \"clef\"), OpenRouter, Requesty and sference (EU, <=16 questions). Needs about 54 GB VRAM in bf16 (independent report). RL fine-tuning service is design-partner only."
  },
  {
   "id": "clef-flash",
   "provider": "cloudflare",
   "family": "Clef",
   "status": "ga",
   "aliases": [
    "@cf/cloudflare/clef-flash",
    "Cloudflare/clef-flash",
    "cloudflare/clef-flash",
    "Cloudflare clef-flash",
    "Clef-flash",
    "Clef Flash"
   ],
   "weights": "open",
   "license": "Apache-2.0",
   "base_model": "Qwen/Qwen3.5-9B",
   "params_total": 9409813744,
   "params_active": null,
   "hf_repo": "Cloudflare/clef-flash",
   "surfaces": [
    "workers-ai",
    "openrouter",
    "self-host",
    "hf-inference"
   ],
   "tier": "clef-flash",
   "released": "2026-10-01",
   "release_source_id": "cloudflare-changelog-clef",
   "access": "general",
   "caveat_ids": [
    "latency-hosted-rtt-vs-on-card",
    "vendor-run-eval-of-competitor",
    "workers-ai-state-truncation-2k",
    "abstention-and-out-of-scope",
    "confidence-field-non-portable",
    "leaderboard-edition-and-weighting-flip-rankings"
   ],
   "notes": "9B sibling of Clef (Qwen3.5-9B base; HF safetensors total 9,409,813,744; Decision Index served_params 9.65B). A different product from the 27B Clef: weaker on out-of-scope (CLINC150+OOS 66.77 vs 97.43 on Cloudflare card) and on the independent Nicia admission task. Same Workers AI schema, 64K context, <=64 questions."
  },
  {
   "id": "openai-decisions-gpt-6-luna",
   "provider": "openai",
   "family": "OpenAI Decisions",
   "status": "preview",
   "aliases": [
    "openai/gpt-6-luna-decisions",
    "OpenAI Decisions",
    "OpenAI Decisions (gpt-6-luna)",
    "GPT-6 Luna Decisions",
    "GPT-6-Luna (Decisions API)"
   ],
   "weights": "closed",
   "license": null,
   "base_model": "GPT-6 Luna (OpenAI: \"a version of GPT-6 Luna\")",
   "params_total": null,
   "params_active": null,
   "hf_repo": null,
   "surfaces": [
    "openai-api",
    "openrouter"
   ],
   "access": "general",
   "caveat_ids": [
    "openai-decisions-api-limited-preview-now-measured-by-one-party",
    "openai-decisions-status-changed",
    "determinism-and-option-order"
   ],
   "notes": "POST https://api.openai.com/v1/decisions with gpt-6-luna (only model). Public beta on 2026-10-07 per docs (\"we expect to GA in the coming weeks\"); earlier research saw 403/limited preview, now superseded. Distinct from the generative gpt-6-luna in model-catalog (which has its own pricing and effort levels). OpenRouter listing openai/gpt-6-luna-decisions created 2026-10-06. Announced at DevDay 2026-09-29 (secondary reports). Not on the Decision Index. Question types predicate/choice/score; per-question refusal answer type."
  },
  {
   "id": "pplx-decider-v1-27b",
   "provider": "perplexity",
   "family": "pplx-decider",
   "status": "ga",
   "aliases": [
    "perplexity/pplx-decider-v1-27b",
    "perplexity-ai/pplx-decider-v1-27b",
    "Perplexity Decider V1 27B"
   ],
   "weights": "open",
   "license": "Apache-2.0",
   "base_model": "Qwen/Qwen3.8-27B",
   "params_total": 26085330160,
   "params_active": null,
   "hf_repo": "perplexity-ai/pplx-decider-v1-27b",
   "surfaces": [
    "other",
    "openrouter",
    "self-host",
    "hf-inference"
   ],
   "access": "general",
   "caveat_ids": [
    "perplexity-price-conflict-direct-vs-router",
    "parameter-counts-hf-vs-index"
   ],
   "notes": "Perplexity first-party Decisions API (POST https://api.perplexity.ai/v1/decisions; any Perplexity API key; 10 requests/s/org). Qwen3_5Model backbone + readout head [255,5120]; HF repo created 2026-10-01 (OpenRouter listing 2026-10-01). params_total is the HF safetensors total (26.09B); the Decision Index uses 27.8B. Direct price $0.02/M input vs $0.04/M on OpenRouter and Requesty (conflict, see pricing/ and caveats)."
  },
  {
   "id": "pplx-decider-v1.1-27b",
   "provider": "perplexity",
   "family": "pplx-decider",
   "status": "ga",
   "aliases": [
    "perplexity-ai/pplx-decider-v1.1-27b",
    "Perplexity Decider v1.1 (27B)",
    "pplx-decider-v1.1"
   ],
   "weights": "open",
   "license": "Apache-2.0",
   "base_model": "Qwen/Qwen3.8-27B",
   "params_total": 26085330160,
   "params_active": null,
   "hf_repo": "perplexity-ai/pplx-decider-v1.1-27b",
   "surfaces": [
    "other",
    "self-host",
    "hf-inference"
   ],
   "access": "general",
   "caveat_ids": [
    "pplx-v1-1-repo-access-conflict",
    "perplexity-price-conflict-direct-vs-router",
    "parameter-counts-hf-vs-index"
   ],
   "notes": "Successor of v1; noncausal full-attention mode. HF repo created 2026-10-05. Rank 1 on the Decision Index 0.3 Full score (62.75). Not on OpenRouter or Requesty at retrieval. Card says private repository, Decision Index note says \"Repo access by request\", HF API showed gated:false on 2026-10-07 (unresolved)."
  },
  {
   "id": "liquid-d1",
   "provider": "liquid",
   "family": "d1",
   "status": "ga",
   "aliases": [
    "liquid/d1",
    "d1",
    "d1:free",
    "Liquid AI d1",
    "LiquidAI: d1"
   ],
   "weights": "closed",
   "license": null,
   "base_model": null,
   "params_total": null,
   "params_active": null,
   "hf_repo": null,
   "surfaces": [
    "other",
    "openrouter"
   ],
   "access": "general",
   "caveat_ids": [
    "scope-limited-decision-models"
   ],